{"content_hash":"sha256:6c69f56a52d824c8162558b02dc3e10188ab3bc67ae5d7eb36506b5357e5cfd3","dependencies":["instance:benchmark:007","support:benchmark-bucket:11","compatibility:benchmark-sheet:3"],"id":"relation:benchmark:007:092","payload":{"active_interval":{"end":92,"start":92},"compatibility_ids":["compatibility:benchmark-sheet:3"],"expression":{"args":[{"name":"rho","op":"field","source":"state"},{"op":"const","value":92}],"op":"sub"},"generative_address":{"bucket":11,"instance":7,"kind":"benchmark-relation","sheet":3,"target":92},"instance_id":"instance:benchmark:007","meaning":"Exact zero when instance 007 reaches rho=92.","priority":92,"support_ids":["support:benchmark-bucket:11"],"topology_sheet":3,"trigger":"enter_zero","zero_test":"equal_zero"},"provenance":{"source":"literal exact-discrete indexed relation"},"record_type":"relation","schema":"TOM-WORLD-RECORD-0.1","version":1}