{"content_hash":"sha256:c98310619d8b91fe8abebd6a8289a1d68a36bc3cbbd71a047a1184f9fb48d214","dependencies":["definition:index-benchmark-linear-world"],"id":"observation:benchmark:211","payload":{"generative_address":{"index":211,"kind":"benchmark-observation"},"meaning":"Non-relation load record used to prove type-first candidate reduction.","time_interval":{"end":17,"start":17},"topology_sheet":3,"value":211},"provenance":{"source":"literal benchmark non-relation population"},"record_type":"observation","schema":"TOM-WORLD-RECORD-0.1","version":1}